{
  "schemaVersion": 1,
  "planId": "aissee-2027-class-06-demo",
  "language": "en",
  "month": "2026-09",
  "days": [
    {
      "date": "2026-09-04",
      "phaseId": "phase-3",
      "weekNumber": 22,
      "topics": [
        {
          "id": "topic-1",
          "subjectId": "science",
          "title": "Ecosystem & Food Chain",
          "activityType": "new-learning",
          "details": "New concept + examples + practice",
          "contentId": "sci-05-photosynthesis"
        }
      ],
      "revision": [
        {
          "id": "revision-1",
          "subjectId": "mathematics",
          "title": "Mensuration",
          "activityType": "spaced-recall",
          "details": "5 quick recall questions"
        }
      ],
      "practiceQuizIds": [
        "sci-05-photosynthesis-01"
      ],
      "studyMaterialIds": [
        "sci-05-photosynthesis"
      ],
      "timetable": [
        {
          "id": "time-1",
          "startTime": "06:00",
          "endTime": "06:30",
          "title": "Morning run + exercise"
        },
        {
          "id": "time-2",
          "startTime": "06:30",
          "endTime": "07:00",
          "title": "Reading / language fluency"
        },
        {
          "id": "time-3",
          "startTime": "18:00",
          "endTime": "18:45",
          "title": "Main study block"
        }
      ]
    },
    {
      "date": "2026-09-05",
      "phaseId": "phase-3",
      "weekNumber": 22,
      "topics": [
        {
          "id": "topic-1",
          "subjectId": "science",
          "title": "Ecosystem & Food Chain",
          "activityType": "new-learning",
          "details": "New concept + examples + practice",
          "contentId": "sci-05-photosynthesis"
        },
        {
          "id": "topic-2",
          "subjectId": "general-knowledge",
          "title": "Sports & Games",
          "activityType": "new-learning",
          "details": "Read + diagram + notes"
        }
      ],
      "revision": [
        {
          "id": "revision-1",
          "subjectId": "mathematics",
          "title": "Mensuration",
          "activityType": "spaced-recall",
          "details": "5 quick recall questions"
        },
        {
          "id": "revision-2",
          "subjectId": "english",
          "title": "Essay Writing",
          "activityType": "spaced-recall",
          "details": "5 quick recall questions"
        },
        {
          "id": "revision-3",
          "subjectId": "mathematics",
          "title": "Volume & Surface Area",
          "activityType": "spaced-recall",
          "details": "5 quick recall questions"
        }
      ],
      "practiceQuizIds": [
        "sci-05-photosynthesis-01"
      ],
      "studyMaterialIds": [
        "sci-05-photosynthesis"
      ],
      "timetable": [
        {
          "id": "time-1",
          "startTime": "06:00",
          "endTime": "06:30",
          "title": "Morning run + exercise"
        },
        {
          "id": "time-2",
          "startTime": "06:30",
          "endTime": "07:00",
          "title": "Reading / language fluency"
        },
        {
          "id": "time-3",
          "startTime": "18:00",
          "endTime": "18:45",
          "title": "Main study block"
        },
        {
          "id": "time-4",
          "startTime": "19:00",
          "endTime": "19:20",
          "title": "Practice quiz + review"
        }
      ]
    },
    {
      "date": "2026-09-06",
      "phaseId": "phase-3",
      "weekNumber": 22,
      "topics": [
        {
          "id": "topic-2",
          "subjectId": "general-knowledge",
          "title": "Sports & Games",
          "activityType": "new-learning",
          "details": "Read + diagram + notes"
        }
      ],
      "revision": [
        {
          "id": "revision-3",
          "subjectId": "mathematics",
          "title": "Volume & Surface Area",
          "activityType": "spaced-recall",
          "details": "5 quick recall questions"
        }
      ],
      "practiceQuizIds": [
        "sci-05-photosynthesis-01"
      ],
      "studyMaterialIds": [
        "sci-05-photosynthesis"
      ],
      "timetable": [
        {
          "id": "time-1",
          "startTime": "06:00",
          "endTime": "06:30",
          "title": "Morning run + exercise"
        },
        {
          "id": "time-2",
          "startTime": "06:30",
          "endTime": "07:00",
          "title": "Reading / language fluency"
        },
        {
          "id": "time-3",
          "startTime": "18:00",
          "endTime": "18:45",
          "title": "Main study block"
        }
      ]
    }
  ]
}
