{
  "schemaVersion": 1,
  "planId": "rms-cet-2027-class-06-demo",
  "language": "en",
  "month": "2026-09",
  "days": [
    {
      "date": "2026-09-04",
      "phaseId": "phase-3",
      "weekNumber": 22,
      "topics": [
        {
          "id": "topic-1",
          "subjectId": "mathematics",
          "title": "Fractions & Arithmetic",
          "activityType": "new-learning",
          "details": "Concept + timed practice",
          "contentId": "math-05-equivalent-fractions"
        }
      ],
      "revision": [
        {
          "id": "revision-1",
          "subjectId": "english",
          "title": "Grammar Review",
          "activityType": "spaced-recall",
          "details": "5 quick questions"
        }
      ],
      "practiceQuizIds": [
        "math-05-equivalent-fractions-02"
      ],
      "studyMaterialIds": [
        "math-05-equivalent-fractions"
      ],
      "timetable": [
        {
          "id": "time-1",
          "startTime": "06:00",
          "endTime": "06:30",
          "title": "Morning run + exercise"
        },
        {
          "id": "time-2",
          "startTime": "06:30",
          "endTime": "07:00",
          "title": "Reading / language fluency"
        },
        {
          "id": "time-3",
          "startTime": "18:00",
          "endTime": "18:45",
          "title": "Main study block"
        }
      ]
    },
    {
      "date": "2026-09-05",
      "phaseId": "phase-3",
      "weekNumber": 22,
      "topics": [
        {
          "id": "topic-1",
          "subjectId": "mathematics",
          "title": "Fractions & Arithmetic",
          "activityType": "new-learning",
          "details": "Concept + timed practice",
          "contentId": "math-05-equivalent-fractions"
        },
        {
          "id": "topic-2",
          "subjectId": "general-knowledge",
          "title": "India & Everyday GK",
          "activityType": "new-learning",
          "details": "Read + recall cards"
        }
      ],
      "revision": [
        {
          "id": "revision-1",
          "subjectId": "english",
          "title": "Grammar Review",
          "activityType": "spaced-recall",
          "details": "5 quick questions"
        },
        {
          "id": "revision-2",
          "subjectId": "intelligence",
          "title": "Number Series",
          "activityType": "spaced-recall",
          "details": "5 quick questions"
        }
      ],
      "practiceQuizIds": [
        "math-05-equivalent-fractions-02",
        "math-05-equivalent-fractions-03"
      ],
      "studyMaterialIds": [
        "math-05-equivalent-fractions"
      ],
      "timetable": [
        {
          "id": "time-1",
          "startTime": "06:00",
          "endTime": "06:30",
          "title": "Morning run + exercise"
        },
        {
          "id": "time-2",
          "startTime": "06:30",
          "endTime": "07:00",
          "title": "Reading / language fluency"
        },
        {
          "id": "time-3",
          "startTime": "18:00",
          "endTime": "18:45",
          "title": "Main study block"
        },
        {
          "id": "time-4",
          "startTime": "19:00",
          "endTime": "19:20",
          "title": "Practice quiz + review"
        }
      ]
    },
    {
      "date": "2026-09-06",
      "phaseId": "phase-3",
      "weekNumber": 22,
      "topics": [
        {
          "id": "topic-2",
          "subjectId": "general-knowledge",
          "title": "India & Everyday GK",
          "activityType": "new-learning",
          "details": "Read + recall cards"
        }
      ],
      "revision": [
        {
          "id": "revision-2",
          "subjectId": "intelligence",
          "title": "Number Series",
          "activityType": "spaced-recall",
          "details": "5 quick questions"
        }
      ],
      "practiceQuizIds": [
        "math-05-equivalent-fractions-03"
      ],
      "studyMaterialIds": [
        "math-05-equivalent-fractions"
      ],
      "timetable": [
        {
          "id": "time-1",
          "startTime": "06:00",
          "endTime": "06:30",
          "title": "Morning run + exercise"
        },
        {
          "id": "time-2",
          "startTime": "06:30",
          "endTime": "07:00",
          "title": "Reading / language fluency"
        },
        {
          "id": "time-3",
          "startTime": "18:00",
          "endTime": "18:45",
          "title": "Main study block"
        }
      ]
    }
  ]
}
